on_offboarding_assignment_id,onboarder_id,offboarder_id,onboarder_contact,offboarder_contact,job_position_task_list_id,onboarder_comments,offboarder_comments
218,920,401,319-695-4345,647-820-3559,79,a ipsum integer a nibh in quis justo maecenas rhoncus aliquam lacus morbi quis,ornare consequat lectus in est risus auctor sed tristique in tempus sit amet sem
690,584,971,847-979-0408,391-467-9808,774,id justo sit amet sapien dignissim vestibulum vestibulum ante ipsum primis in,vestibulum ante ipsum primis in faucibus orci luctus et ultrices posuere cubilia curae
770,460,620,862-721-3393,929-703-6854,755,molestie nibh in lectus pellentesque at nulla suspendisse potenti cras in purus,platea dictumst aliquam augue quam sollicitudin vitae consectetuer eget rutrum at lorem
141,644,605,923-947-4516,562-768-9760,72,sem duis aliquam convallis nunc proin at turpis a pede posuere nonummy integer non velit donec diam neque,lectus vestibulum quam sapien varius ut blandit non interdum in ante vestibulum ante ipsum primis
95,581,899,334-462-8802,948-790-5593,491,curabitur gravida nisi at nibh in hac habitasse platea dictumst aliquam augue quam sollicitudin vitae consectetuer,sapien quis libero nullam sit amet turpis elementum ligula vehicula consequat morbi a ipsum integer a nibh in quis justo
362,281,962,957-870-8139,390-660-1643,345,ligula suspendisse ornare consequat lectus in est risus auctor sed tristique in tempus sit amet sem,tristique fusce congue diam id ornare imperdiet sapien urna pretium nisl ut
665,282,373,634-684-7083,423-779-1729,328,pellentesque volutpat dui maecenas tristique est et tempus semper est quam pharetra magna ac consequat metus sapien ut nunc,sem mauris laoreet ut rhoncus aliquet pulvinar sed nisl nunc
966,925,361,989-539-8376,216-125-9458,322,enim lorem ipsum dolor sit amet consectetuer adipiscing elit proin interdum mauris non ligula pellentesque,a nibh in quis justo maecenas rhoncus aliquam lacus morbi quis tortor id nulla ultrices aliquet maecenas leo odio condimentum
820,497,43,831-354-4433,870-962-1541,567,bibendum morbi non quam nec dui luctus rutrum nulla tellus in sagittis dui vel nisl duis ac nibh,cursus vestibulum proin eu mi nulla ac enim in tempor turpis nec euismod
848,991,410,566-694-7002,752-384-2763,813,adipiscing elit proin interdum mauris non ligula pellentesque ultrices phasellus,erat tortor sollicitudin mi sit amet lobortis sapien sapien non mi integer ac neque duis bibendum
318,374,386,998-644-9448,801-231-5580,189,libero quis orci nullam molestie nibh in lectus pellentesque at nulla suspendisse potenti cras in purus eu magna vulputate luctus,mauris morbi non lectus aliquam sit amet diam in magna bibendum
773,872,90,630-941-0832,733-140-7089,673,diam in magna bibendum imperdiet nullam orci pede venenatis non,molestie sed justo pellentesque viverra pede ac diam cras pellentesque volutpat dui maecenas
280,579,203,369-345-2489,109-801-4354,246,elementum ligula vehicula consequat morbi a ipsum integer a nibh in,elit sodales scelerisque mauris sit amet eros suspendisse accumsan tortor quis
740,332,312,122-941-6680,290-555-4241,124,venenatis turpis enim blandit mi in porttitor pede justo eu massa donec dapibus duis at velit eu est congue,mi nulla ac enim in tempor turpis nec euismod scelerisque quam turpis adipiscing lorem vitae mattis nibh ligula
522,163,460,920-835-9191,838-151-6133,423,dapibus duis at velit eu est congue elementum in hac,tincidunt nulla mollis molestie lorem quisque ut erat curabitur gravida nisi at nibh in hac habitasse platea
564,836,90,136-971-8405,319-106-5608,646,pede justo lacinia eget tincidunt eget tempus vel pede morbi porttitor lorem id ligula,non ligula pellentesque ultrices phasellus id sapien in sapien iaculis congue vivamus
377,634,342,153-511-4513,321-459-2621,343,viverra eget congue eget semper rutrum nulla nunc purus phasellus in felis,faucibus orci luctus et ultrices posuere cubilia curae duis faucibus
160,818,900,360-446-2464,857-468-4007,613,elementum pellentesque quisque porta volutpat erat quisque erat eros viverra eget congue eget semper rutrum,aenean fermentum donec ut mauris eget massa tempor convallis nulla neque libero convallis eget eleifend
544,612,200,281-407-9769,288-778-5910,175,maecenas pulvinar lobortis est phasellus sit amet erat nulla tempus vivamus in,arcu libero rutrum ac lobortis vel dapibus at diam nam
408,689,580,526-811-6850,872-669-7407,391,massa id lobortis convallis tortor risus dapibus augue vel accumsan tellus nisi eu orci mauris,ac nulla sed vel enim sit amet nunc viverra dapibus nulla suscipit ligula in
311,843,107,237-932-8918,340-409-9485,766,ligula in lacus curabitur at ipsum ac tellus semper interdum mauris ullamcorper purus,amet justo morbi ut odio cras mi pede malesuada in imperdiet et commodo
142,953,495,806-780-9461,309-366-3700,225,tempus sit amet sem fusce consequat nulla nisl nunc nisl duis bibendum felis sed interdum venenatis,natoque penatibus et magnis dis parturient montes nascetur ridiculus mus vivamus vestibulum sagittis sapien cum sociis natoque penatibus et magnis
115,993,511,601-357-5997,892-388-4423,759,quisque ut erat curabitur gravida nisi at nibh in hac habitasse platea,etiam faucibus cursus urna ut tellus nulla ut erat id
578,369,140,901-597-8700,585-388-2548,431,quis turpis eget elit sodales scelerisque mauris sit amet eros,cras mi pede malesuada in imperdiet et commodo vulputate justo in blandit
728,210,452,152-108-1590,715-878-3433,533,ut volutpat sapien arcu sed augue aliquam erat volutpat in congue etiam justo,morbi non lectus aliquam sit amet diam in magna bibendum imperdiet nullam orci pede venenatis non sodales
680,653,893,818-692-3323,491-757-6492,594,praesent lectus vestibulum quam sapien varius ut blandit non interdum in ante vestibulum ante ipsum primis in,ligula nec sem duis aliquam convallis nunc proin at turpis a pede posuere nonummy
880,289,463,270-889-8801,815-602-1377,830,et ultrices posuere cubilia curae duis faucibus accumsan odio curabitur convallis duis consequat dui nec nisi volutpat,dapibus duis at velit eu est congue elementum in hac habitasse platea dictumst morbi
56,276,635,142-948-1824,216-529-9390,606,pellentesque ultrices phasellus id sapien in sapien iaculis congue vivamus metus arcu adipiscing molestie hendrerit,rutrum at lorem integer tincidunt ante vel ipsum praesent blandit lacinia erat vestibulum sed magna at nunc
295,982,456,268-225-6016,388-521-2700,636,lectus vestibulum quam sapien varius ut blandit non interdum in ante vestibulum ante ipsum primis in faucibus orci luctus,nulla ac enim in tempor turpis nec euismod scelerisque quam turpis adipiscing lorem vitae mattis nibh ligula nec sem duis
748,793,119,502-426-1419,878-521-7379,699,nulla tempus vivamus in felis eu sapien cursus vestibulum proin eu mi nulla,natoque penatibus et magnis dis parturient montes nascetur ridiculus mus etiam vel
296,640,354,136-778-9074,480-376-4721,796,platea dictumst morbi vestibulum velit id pretium iaculis diam erat fermentum justo nec condimentum neque,volutpat sapien arcu sed augue aliquam erat volutpat in congue etiam justo etiam pretium iaculis justo in hac habitasse
244,886,110,641-617-8543,190-503-1649,483,diam neque vestibulum eget vulputate ut ultrices vel augue vestibulum ante ipsum primis in faucibus orci luctus et,porttitor pede justo eu massa donec dapibus duis at velit eu est congue
635,336,880,805-484-5942,656-946-4086,122,aliquet ultrices erat tortor sollicitudin mi sit amet lobortis sapien sapien,ac leo pellentesque ultrices mattis odio donec vitae nisi nam ultrices libero non
788,796,19,378-201-5044,129-443-0848,97,facilisi cras non velit nec nisi vulputate nonummy maecenas tincidunt lacus at velit vivamus vel nulla eget eros elementum pellentesque,odio justo sollicitudin ut suscipit a feugiat et eros vestibulum ac est lacinia nisi venenatis tristique fusce congue
197,616,782,666-833-7113,776-892-1376,740,dolor quis odio consequat varius integer ac leo pellentesque ultrices mattis odio donec vitae nisi nam ultrices,nibh in quis justo maecenas rhoncus aliquam lacus morbi quis tortor id nulla ultrices aliquet
101,443,906,686-339-3950,490-480-0939,702,amet lobortis sapien sapien non mi integer ac neque duis bibendum morbi non,vestibulum ante ipsum primis in faucibus orci luctus et ultrices posuere cubilia curae nulla dapibus dolor
576,795,245,179-710-2154,811-276-6842,736,interdum mauris non ligula pellentesque ultrices phasellus id sapien in sapien iaculis congue vivamus metus arcu adipiscing,sem praesent id massa id nisl venenatis lacinia aenean sit amet justo morbi ut
556,482,109,866-476-6368,976-296-7396,281,aliquet at feugiat non pretium quis lectus suspendisse potenti in,aenean lectus pellentesque eget nunc donec quis orci eget orci vehicula condimentum
79,194,779,603-545-3803,919-828-6169,34,velit vivamus vel nulla eget eros elementum pellentesque quisque porta volutpat erat,nisi venenatis tristique fusce congue diam id ornare imperdiet sapien urna pretium nisl ut volutpat sapien arcu sed
968,460,441,578-690-6821,509-568-8320,821,ultrices mattis odio donec vitae nisi nam ultrices libero non mattis pulvinar nulla pede,ultricies eu nibh quisque id justo sit amet sapien dignissim vestibulum vestibulum ante
153,268,93,662-522-9464,793-840-0224,257,ligula sit amet eleifend pede libero quis orci nullam molestie nibh,ac est lacinia nisi venenatis tristique fusce congue diam id ornare imperdiet sapien urna pretium
209,441,735,363-985-1189,414-300-3181,304,sed sagittis nam congue risus semper porta volutpat quam pede lobortis ligula sit amet eleifend,vitae quam suspendisse potenti nullam porttitor lacus at turpis donec posuere metus
486,487,199,334-325-1903,202-806-2074,840,id luctus nec molestie sed justo pellentesque viverra pede ac diam cras pellentesque volutpat dui maecenas tristique,in magna bibendum imperdiet nullam orci pede venenatis non sodales sed tincidunt eu felis fusce posuere felis sed lacus morbi
48,718,650,139-922-4538,164-297-6833,183,eget eros elementum pellentesque quisque porta volutpat erat quisque erat eros viverra eget congue eget semper rutrum nulla nunc,ut mauris eget massa tempor convallis nulla neque libero convallis eget eleifend luctus ultricies eu nibh
441,543,979,478-599-5266,420-297-8073,450,tempus sit amet sem fusce consequat nulla nisl nunc nisl duis bibendum felis sed interdum venenatis turpis enim blandit mi,quis orci nullam molestie nibh in lectus pellentesque at nulla suspendisse potenti cras in purus eu magna
637,816,451,979-783-0466,140-460-4562,432,praesent id massa id nisl venenatis lacinia aenean sit amet justo morbi ut odio cras mi pede,velit donec diam neque vestibulum eget vulputate ut ultrices vel
760,332,916,247-769-4322,688-270-2434,381,blandit ultrices enim lorem ipsum dolor sit amet consectetuer adipiscing elit proin interdum,quam a odio in hac habitasse platea dictumst maecenas ut massa quis augue luctus tincidunt nulla mollis molestie lorem quisque
5,648,60,302-182-0712,922-117-4783,24,sapien urna pretium nisl ut volutpat sapien arcu sed augue aliquam erat volutpat in congue etiam justo,ligula sit amet eleifend pede libero quis orci nullam molestie
269,292,394,728-735-0839,987-237-0899,8,vivamus metus arcu adipiscing molestie hendrerit at vulputate vitae nisl aenean lectus pellentesque eget nunc donec quis orci eget orci,leo odio porttitor id consequat in consequat ut nulla sed accumsan felis ut
648,741,376,988-915-8295,656-113-7861,780,bibendum imperdiet nullam orci pede venenatis non sodales sed tincidunt eu felis fusce posuere felis,suscipit nulla elit ac nulla sed vel enim sit amet nunc viverra dapibus nulla suscipit ligula in
810,538,178,440-185-1828,888-491-4698,86,sed augue aliquam erat volutpat in congue etiam justo etiam pretium iaculis justo in,fusce congue diam id ornare imperdiet sapien urna pretium nisl
265,910,647,565-378-1057,936-888-0968,539,amet nulla quisque arcu libero rutrum ac lobortis vel dapibus at diam nam tristique tortor,orci eget orci vehicula condimentum curabitur in libero ut massa volutpat convallis morbi odio odio
269,443,855,144-912-5945,802-629-9760,251,lorem id ligula suspendisse ornare consequat lectus in est risus,proin at turpis a pede posuere nonummy integer non velit donec diam neque vestibulum eget
521,168,899,493-735-1507,814-518-8121,949,ultrices posuere cubilia curae donec pharetra magna vestibulum aliquet ultrices erat tortor sollicitudin mi sit amet lobortis,a odio in hac habitasse platea dictumst maecenas ut massa quis augue luctus tincidunt nulla mollis molestie
980,808,605,901-528-1823,543-876-1961,68,vitae consectetuer eget rutrum at lorem integer tincidunt ante vel ipsum praesent blandit lacinia erat vestibulum sed magna at nunc,fringilla rhoncus mauris enim leo rhoncus sed vestibulum sit amet cursus id turpis integer aliquet massa id lobortis
263,318,785,338-598-0802,699-870-2240,723,tellus nisi eu orci mauris lacinia sapien quis libero nullam sit amet,nulla ultrices aliquet maecenas leo odio condimentum id luctus nec molestie sed justo pellentesque viverra pede ac diam cras pellentesque
264,99,784,571-752-5348,906-440-0819,225,nulla quisque arcu libero rutrum ac lobortis vel dapibus at,risus semper porta volutpat quam pede lobortis ligula sit amet eleifend pede libero quis orci
780,771,548,104-447-2286,948-494-3117,450,ac enim in tempor turpis nec euismod scelerisque quam turpis,lacus purus aliquet at feugiat non pretium quis lectus suspendisse potenti in eleifend quam a odio in
584,637,966,398-639-0616,565-107-1271,59,in quam fringilla rhoncus mauris enim leo rhoncus sed vestibulum,nunc commodo placerat praesent blandit nam nulla integer pede justo lacinia
372,45,628,306-948-4737,308-334-9825,441,mi nulla ac enim in tempor turpis nec euismod scelerisque quam turpis adipiscing lorem vitae,maecenas ut massa quis augue luctus tincidunt nulla mollis molestie lorem quisque ut
387,821,300,635-274-7410,409-196-1384,732,pellentesque viverra pede ac diam cras pellentesque volutpat dui maecenas tristique est et tempus semper est quam pharetra magna,montes nascetur ridiculus mus vivamus vestibulum sagittis sapien cum sociis natoque penatibus et magnis dis parturient montes nascetur
710,897,891,937-380-2496,575-667-9538,223,sit amet consectetuer adipiscing elit proin risus praesent lectus vestibulum quam sapien varius ut,sed tincidunt eu felis fusce posuere felis sed lacus morbi
7,253,193,961-266-4308,132-291-3512,710,leo odio porttitor id consequat in consequat ut nulla sed accumsan felis ut at dolor quis,habitasse platea dictumst etiam faucibus cursus urna ut tellus nulla ut erat id mauris vulputate elementum nullam varius nulla
133,607,473,933-478-1227,755-137-3032,912,aliquam lacus morbi quis tortor id nulla ultrices aliquet maecenas leo odio condimentum id,maecenas ut massa quis augue luctus tincidunt nulla mollis molestie lorem quisque
746,752,696,961-680-3419,270-975-8073,334,ante ipsum primis in faucibus orci luctus et ultrices posuere cubilia curae mauris viverra diam vitae quam,erat fermentum justo nec condimentum neque sapien placerat ante nulla
487,618,750,140-532-2869,177-311-4812,309,ut suscipit a feugiat et eros vestibulum ac est lacinia nisi venenatis,mattis nibh ligula nec sem duis aliquam convallis nunc proin at
823,954,852,482-391-2209,823-737-5872,219,in hac habitasse platea dictumst maecenas ut massa quis augue luctus tincidunt nulla mollis molestie lorem quisque,at dolor quis odio consequat varius integer ac leo pellentesque ultrices mattis odio donec vitae nisi nam
579,81,183,245-439-3288,754-142-7397,988,tortor sollicitudin mi sit amet lobortis sapien sapien non mi integer ac neque duis bibendum,justo in hac habitasse platea dictumst etiam faucibus cursus urna
879,526,10,190-793-1569,156-375-0307,136,sagittis sapien cum sociis natoque penatibus et magnis dis parturient montes nascetur ridiculus mus etiam,molestie nibh in lectus pellentesque at nulla suspendisse potenti cras in purus
277,441,255,662-660-0742,764-689-1587,754,neque sapien placerat ante nulla justo aliquam quis turpis eget elit sodales scelerisque mauris sit amet eros suspendisse accumsan,nec dui luctus rutrum nulla tellus in sagittis dui vel nisl duis
449,34,309,557-932-2684,433-619-5463,473,metus vitae ipsum aliquam non mauris morbi non lectus aliquam sit amet diam,sem duis aliquam convallis nunc proin at turpis a pede posuere nonummy integer non velit
359,533,667,347-944-7228,654-642-3519,942,venenatis non sodales sed tincidunt eu felis fusce posuere felis sed,ipsum primis in faucibus orci luctus et ultrices posuere cubilia curae donec pharetra magna
572,327,376,212-966-0564,425-395-9429,752,justo eu massa donec dapibus duis at velit eu est congue elementum in hac habitasse platea dictumst,ultrices libero non mattis pulvinar nulla pede ullamcorper augue a suscipit nulla
810,704,443,368-232-8831,432-205-5893,885,tempor turpis nec euismod scelerisque quam turpis adipiscing lorem vitae mattis,ut blandit non interdum in ante vestibulum ante ipsum primis in faucibus orci
797,617,83,735-796-8699,571-753-0437,691,velit vivamus vel nulla eget eros elementum pellentesque quisque porta,curabitur in libero ut massa volutpat convallis morbi odio odio elementum eu interdum eu tincidunt in leo maecenas pulvinar
235,289,295,685-487-9100,335-930-5428,60,nascetur ridiculus mus etiam vel augue vestibulum rutrum rutrum neque aenean,curae nulla dapibus dolor vel est donec odio justo sollicitudin ut suscipit a feugiat et eros vestibulum ac est lacinia
946,616,879,870-428-1944,742-366-6956,269,elementum in hac habitasse platea dictumst morbi vestibulum velit id pretium iaculis diam erat fermentum justo nec,convallis nulla neque libero convallis eget eleifend luctus ultricies eu nibh quisque
468,607,994,132-675-1375,113-679-7762,424,vitae mattis nibh ligula nec sem duis aliquam convallis nunc proin at turpis a pede posuere nonummy integer non velit,primis in faucibus orci luctus et ultrices posuere cubilia curae donec pharetra magna vestibulum aliquet ultrices erat tortor sollicitudin
349,478,685,816-658-4666,984-496-0717,439,augue vel accumsan tellus nisi eu orci mauris lacinia sapien quis libero nullam sit amet turpis elementum,ut nulla sed accumsan felis ut at dolor quis odio consequat varius integer
605,265,712,943-837-1032,302-313-2280,89,massa volutpat convallis morbi odio odio elementum eu interdum eu tincidunt in leo maecenas pulvinar lobortis est,turpis integer aliquet massa id lobortis convallis tortor risus dapibus augue vel accumsan tellus nisi eu orci
388,299,356,644-700-4043,980-441-4698,556,id massa id nisl venenatis lacinia aenean sit amet justo,sit amet nunc viverra dapibus nulla suscipit ligula in lacus curabitur at ipsum ac tellus
721,879,671,205-769-1168,855-147-5269,865,nulla suscipit ligula in lacus curabitur at ipsum ac tellus semper interdum mauris ullamcorper purus sit amet nulla quisque arcu,eget eros elementum pellentesque quisque porta volutpat erat quisque erat eros viverra eget congue eget semper rutrum
821,808,559,388-928-9041,135-359-0760,356,ultrices posuere cubilia curae mauris viverra diam vitae quam suspendisse potenti nullam porttitor lacus at,eu tincidunt in leo maecenas pulvinar lobortis est phasellus sit
404,834,354,649-125-4587,424-598-3516,476,in hac habitasse platea dictumst maecenas ut massa quis augue,curabitur in libero ut massa volutpat convallis morbi odio odio elementum
990,844,719,457-966-8130,829-230-4018,39,praesent blandit nam nulla integer pede justo lacinia eget tincidunt eget tempus vel pede morbi,faucibus orci luctus et ultrices posuere cubilia curae mauris viverra diam vitae
558,509,302,872-666-9095,761-313-9431,884,sem sed sagittis nam congue risus semper porta volutpat quam pede lobortis ligula sit amet eleifend pede libero,libero ut massa volutpat convallis morbi odio odio elementum eu interdum eu tincidunt
80,160,564,416-393-6179,247-751-2978,597,aenean sit amet justo morbi ut odio cras mi pede malesuada in imperdiet et commodo,ut erat curabitur gravida nisi at nibh in hac habitasse platea dictumst aliquam augue quam sollicitudin vitae consectetuer eget rutrum
597,514,218,304-123-9312,228-134-8376,353,mi integer ac neque duis bibendum morbi non quam nec dui luctus rutrum nulla tellus in sagittis dui vel,vestibulum sagittis sapien cum sociis natoque penatibus et magnis dis parturient montes nascetur ridiculus
949,867,211,573-948-6460,713-586-3183,162,fermentum justo nec condimentum neque sapien placerat ante nulla justo aliquam quis turpis eget,luctus tincidunt nulla mollis molestie lorem quisque ut erat curabitur gravida nisi
899,478,618,450-795-0521,116-538-6572,247,vestibulum vestibulum ante ipsum primis in faucibus orci luctus et ultrices posuere cubilia curae nulla dapibus,vel lectus in quam fringilla rhoncus mauris enim leo rhoncus sed vestibulum sit amet cursus id turpis
858,361,597,691-201-9999,190-681-3501,91,augue vestibulum rutrum rutrum neque aenean auctor gravida sem praesent,nisl ut volutpat sapien arcu sed augue aliquam erat volutpat
93,749,761,202-985-7803,753-898-9963,714,convallis morbi odio odio elementum eu interdum eu tincidunt in leo maecenas pulvinar lobortis,mauris lacinia sapien quis libero nullam sit amet turpis elementum ligula
642,456,931,109-692-4894,723-948-4597,492,etiam justo etiam pretium iaculis justo in hac habitasse platea dictumst etiam faucibus cursus,augue quam sollicitudin vitae consectetuer eget rutrum at lorem integer tincidunt
779,981,282,803-932-4481,272-665-4347,591,ut suscipit a feugiat et eros vestibulum ac est lacinia nisi venenatis tristique fusce,in ante vestibulum ante ipsum primis in faucibus orci luctus
774,817,72,992-672-0250,287-744-7574,991,in hac habitasse platea dictumst etiam faucibus cursus urna ut tellus,id pretium iaculis diam erat fermentum justo nec condimentum neque
438,789,783,346-131-4218,980-895-8049,940,pretium iaculis justo in hac habitasse platea dictumst etiam faucibus cursus,molestie nibh in lectus pellentesque at nulla suspendisse potenti cras in purus eu magna vulputate luctus cum
51,336,934,724-460-8266,827-897-7745,730,nisi vulputate nonummy maecenas tincidunt lacus at velit vivamus vel nulla eget,molestie nibh in lectus pellentesque at nulla suspendisse potenti cras in
753,484,532,978-620-3771,674-727-5002,9,aenean fermentum donec ut mauris eget massa tempor convallis nulla neque libero convallis eget eleifend luctus,nulla ut erat id mauris vulputate elementum nullam varius nulla facilisi cras non velit nec nisi vulputate nonummy maecenas tincidunt
872,533,790,255-414-4002,467-786-6960,1000,sapien dignissim vestibulum vestibulum ante ipsum primis in faucibus orci luctus,mauris ullamcorper purus sit amet nulla quisque arcu libero rutrum ac lobortis vel dapibus
893,729,347,183-640-3385,962-862-7085,2,elementum in hac habitasse platea dictumst morbi vestibulum velit id pretium iaculis diam erat fermentum justo nec condimentum,maecenas ut massa quis augue luctus tincidunt nulla mollis molestie lorem quisque ut
