performance_review_id,employee_id,performance_review_date,reviewer,performance_rating,reviewer_comments,development_plans,training_areas
1,1,5/5/2023,45,10,morbi non lectus,pharetra magna vestibulum aliquet ultrices erat tortor sollicitudin,ante
2,2,8/12/2023,32,9,fusce congue,etiam justo etiam pretium iaculis justo in,proin
3,3,9/19/2023,38,6,vel pede morbi,cubilia curae duis faucibus accumsan,vulputate
4,4,3/14/2023,7,4,non pretium,eu tincidunt in leo maecenas pulvinar lobortis,faucibus cursus
5,5,1/9/2023,36,9,ipsum,nisi volutpat eleifend donec ut,blandit
6,6,10/11/2023,25,4,nullam,pretium nisl ut volutpat sapien arcu sed augue,ullamcorper purus
7,7,11/2/2023,66,8,dictumst maecenas ut,venenatis turpis enim blandit mi in porttitor,et eros
8,8,6/28/2023,13,2,diam cras pellentesque,fusce consequat nulla nisl nunc nisl duis,ante
9,9,11/19/2023,80,7,orci luctus,integer ac neque duis bibendum morbi non,ipsum
10,10,5/15/2023,6,2,tristique,mi nulla ac enim in tempor turpis,ultrices
11,11,4/17/2023,90,7,diam nam,lectus aliquam sit amet diam,etiam
12,12,12/17/2023,37,1,nam tristique tortor,nulla suspendisse potenti cras in purus,donec posuere metus
13,13,5/14/2023,43,10,quis tortor id,tempus semper est quam pharetra,mauris morbi non
14,14,4/27/2023,47,7,fusce posuere,consectetuer adipiscing elit proin interdum mauris non ligula,curae
15,15,10/28/2023,18,4,curabitur,erat quisque erat eros viverra eget congue,luctus et ultrices
16,16,9/6/2023,9,5,pede ullamcorper augue,est phasellus sit amet erat nulla tempus vivamus,curabitur gravida
17,17,2/4/2023,63,4,pellentesque viverra,hendrerit at vulputate vitae nisl aenean lectus pellentesque,donec odio justo
18,18,3/29/2023,42,6,a libero nam,bibendum imperdiet nullam orci pede venenatis non,duis
19,19,11/15/2023,15,2,lorem vitae mattis,dis parturient montes nascetur ridiculus mus etiam,lorem quisque ut
20,20,1/22/2023,38,3,lacus at,interdum eu tincidunt in leo maecenas,et eros vestibulum
21,21,1/13/2023,18,2,vestibulum ante,placerat ante nulla justo aliquam,libero ut
22,22,2/5/2023,29,8,dapibus nulla,vel enim sit amet nunc viverra,pellentesque quisque porta
23,23,6/18/2023,81,5,rutrum,ut rhoncus aliquet pulvinar sed nisl nunc rhoncus,fusce lacus purus
24,24,6/11/2023,91,7,eros viverra eget,dignissim vestibulum vestibulum ante ipsum,blandit non
25,25,8/24/2023,7,2,accumsan,lectus pellentesque at nulla suspendisse potenti cras in,ante vel ipsum
26,26,6/4/2023,24,6,convallis,ut nunc vestibulum ante ipsum,fusce lacus purus
27,27,6/26/2023,39,1,at nunc,convallis morbi odio odio elementum,suspendisse ornare consequat
28,28,6/22/2023,75,3,donec,ut rhoncus aliquet pulvinar sed,convallis tortor risus
29,29,9/21/2023,79,4,sit amet,lacus morbi quis tortor id nulla ultrices,vel pede
30,30,12/14/2023,32,10,pede,ut nunc vestibulum ante ipsum primis,ante
31,31,8/31/2023,88,5,eu tincidunt,risus auctor sed tristique in tempus,sapien cum sociis
32,32,9/4/2023,92,7,scelerisque mauris sit,accumsan tellus nisi eu orci mauris lacinia,tortor risus dapibus
33,33,12/10/2023,15,7,tortor risus dapibus,in hac habitasse platea dictumst aliquam,integer ac neque
34,34,7/9/2023,20,3,eget,sed vel enim sit amet nunc,tempus
35,35,5/30/2023,23,10,vel,et ultrices posuere cubilia curae,praesent lectus vestibulum
36,36,8/19/2023,42,7,turpis,bibendum imperdiet nullam orci pede venenatis non sodales,sed
37,37,7/21/2023,18,6,amet diam,sit amet nulla quisque arcu libero rutrum,pulvinar nulla
38,38,6/27/2023,2,9,pede,nulla mollis molestie lorem quisque,ut volutpat sapien
39,39,7/13/2023,75,2,phasellus,velit eu est congue elementum in hac,varius
40,40,10/10/2023,46,10,venenatis lacinia aenean,dui vel nisl duis ac nibh fusce,convallis nunc proin
41,41,10/10/2023,97,7,metus aenean,dapibus duis at velit eu est congue elementum,vel est donec
42,42,8/12/2023,16,4,pede justo eu,metus vitae ipsum aliquam non mauris morbi non,dapibus dolor vel
43,43,4/18/2023,70,1,nulla justo aliquam,justo etiam pretium iaculis justo,nibh
44,44,3/21/2023,78,6,sit,dapibus nulla suscipit ligula in lacus,aliquam erat
45,45,1/24/2023,2,8,mattis,lectus in est risus auctor sed tristique,hac habitasse platea
46,46,11/8/2023,72,6,nullam orci pede,sed interdum venenatis turpis enim,mus etiam
47,47,10/28/2023,96,4,in hac habitasse,odio odio elementum eu interdum,at nulla suspendisse
48,48,9/27/2023,49,2,tortor risus dapibus,interdum mauris non ligula pellentesque,orci pede venenatis
49,49,1/30/2023,42,4,convallis tortor,sapien non mi integer ac neque duis,enim
50,50,11/17/2023,31,2,nam,tellus in sagittis dui vel,pretium
51,51,9/4/2023,28,6,quis turpis eget,pellentesque ultrices phasellus id sapien,nisl
52,52,8/2/2023,25,2,hac habitasse,et eros vestibulum ac est lacinia,dictumst morbi
53,53,8/21/2023,14,10,nulla,quis tortor id nulla ultrices,ipsum
54,54,3/29/2023,62,10,sit amet turpis,donec diam neque vestibulum eget vulputate ut ultrices,cum
55,55,11/8/2023,45,9,nulla tempus vivamus,at vulputate vitae nisl aenean lectus pellentesque eget,tempus
56,56,10/8/2023,12,2,morbi,justo nec condimentum neque sapien placerat ante nulla,morbi
57,57,7/2/2023,1,7,nonummy,nulla tempus vivamus in felis eu,luctus cum
58,58,4/12/2023,70,4,eget rutrum,massa id nisl venenatis lacinia,duis bibendum
59,59,9/26/2023,85,5,ornare consequat lectus,nisl ut volutpat sapien arcu sed augue,ornare consequat lectus
60,60,12/16/2023,9,2,in congue etiam,proin leo odio porttitor id consequat in consequat,sit
61,61,12/21/2023,65,5,at,erat id mauris vulputate elementum nullam varius nulla,molestie hendrerit
62,62,8/30/2023,25,2,posuere,lacus at velit vivamus vel nulla eget eros,donec posuere
63,63,12/27/2023,57,2,curabitur in,primis in faucibus orci luctus,eget massa tempor
64,64,7/20/2023,34,6,morbi,ac nulla sed vel enim sit amet,ut suscipit
65,65,9/15/2023,98,3,imperdiet,nulla suspendisse potenti cras in purus eu,tristique fusce
66,66,10/26/2023,23,3,neque sapien placerat,molestie sed justo pellentesque viverra pede ac,sem fusce
67,67,7/11/2023,60,1,sit,in sagittis dui vel nisl duis,in lectus pellentesque
68,68,3/20/2023,89,8,leo odio,ullamcorper augue a suscipit nulla,donec pharetra magna
69,69,4/13/2023,46,1,vestibulum,et ultrices posuere cubilia curae nulla,cursus vestibulum proin
70,70,10/7/2023,94,6,sed vel,magna bibendum imperdiet nullam orci pede,at turpis
71,71,4/29/2023,70,9,eget vulputate,pede ullamcorper augue a suscipit nulla elit ac,a feugiat
72,72,1/4/2023,78,1,purus aliquet at,turpis adipiscing lorem vitae mattis,interdum
73,73,4/20/2023,92,9,maecenas tincidunt lacus,ut massa quis augue luctus tincidunt nulla mollis,morbi
74,74,2/6/2023,79,1,neque vestibulum eget,nullam sit amet turpis elementum ligula vehicula,nam congue
75,75,9/4/2023,8,10,in,phasellus in felis donec semper sapien a,vel pede morbi
76,76,8/29/2023,42,3,porttitor,nonummy maecenas tincidunt lacus at,duis faucibus accumsan
77,77,11/23/2023,69,2,vehicula,habitasse platea dictumst etiam faucibus cursus urna,luctus rutrum
78,78,5/10/2023,12,6,odio,nonummy maecenas tincidunt lacus at velit vivamus vel,accumsan
79,79,7/27/2023,24,5,in faucibus orci,nunc purus phasellus in felis donec semper sapien,justo sollicitudin
80,80,7/22/2023,87,8,ipsum praesent blandit,tellus nulla ut erat id,nulla elit
81,81,9/17/2023,29,4,dolor sit amet,elit proin risus praesent lectus vestibulum quam sapien,nisl
82,82,1/19/2023,85,2,dui luctus rutrum,dui maecenas tristique est et tempus semper,aenean
83,83,2/9/2023,37,6,consectetuer,eu nibh quisque id justo sit amet sapien,nulla tellus
84,84,8/14/2023,63,3,id pretium iaculis,praesent blandit lacinia erat vestibulum sed magna,auctor sed tristique
85,85,3/24/2023,68,4,placerat ante nulla,lobortis vel dapibus at diam nam tristique tortor,massa
86,86,11/17/2023,73,7,posuere cubilia,pellentesque at nulla suspendisse potenti cras in purus,euismod scelerisque
87,87,11/5/2023,63,7,curae nulla,enim in tempor turpis nec euismod scelerisque quam,cubilia curae mauris
88,88,7/27/2023,31,1,ultrices mattis,pulvinar nulla pede ullamcorper augue a suscipit nulla,et eros
89,89,11/27/2023,85,2,dignissim,sit amet erat nulla tempus vivamus in felis,eget
90,90,3/1/2023,90,8,nibh in,non pretium quis lectus suspendisse potenti,in quam fringilla
91,91,2/14/2023,26,8,rhoncus mauris,adipiscing lorem vitae mattis nibh ligula,iaculis
92,92,3/13/2023,10,9,sapien arcu,bibendum imperdiet nullam orci pede,diam
93,93,11/11/2023,37,9,consequat,posuere metus vitae ipsum aliquam non mauris,suspendisse
94,94,4/30/2023,3,4,aliquam non,molestie lorem quisque ut erat curabitur gravida nisi,hendrerit at
95,95,2/13/2023,66,1,sapien varius,sem fusce consequat nulla nisl,vivamus
96,96,10/21/2023,30,7,non lectus,aliquam convallis nunc proin at turpis a pede,in
97,97,12/28/2023,75,5,lacinia eget,convallis eget eleifend luctus ultricies eu nibh,auctor sed
98,98,7/15/2023,43,8,condimentum,ut ultrices vel augue vestibulum ante,ac consequat
99,99,3/14/2023,92,2,sit amet,aliquam quis turpis eget elit,aliquet maecenas
100,100,6/9/2023,61,3,sed vel enim,in faucibus orci luctus et ultrices,dolor
